{
  "schemaVersion": 1,
  "course": {
    "id": "matriculation-physics",
    "slug": "matriculation-physics",
    "name": "Matriculation Physics"
  },
  "curriculumVersion": {
    "id": "curriculum-physics-2022-2023",
    "code": "PHYSICS-2022-2023",
    "name": "Matriculation Physics - Session 2022/2023",
    "effectiveFrom": null,
    "effectiveTo": null,
    "status": "draft",
    "order": 1
  },
  "semesters": [
    {
      "id": "semester-physics-2022-2023-1",
      "slug": "physics-2022-2023-semester-1",
      "name": "Semester 1",
      "order": 1,
      "status": "active",
      "isTest": false,
      "chapters": [
        {
          "id": "chapter-sp015-2022-2023-1",
          "slug": "1-0-physical-quantities-and-measurements",
          "name": "1.0 Physical Quantities and Measurements",
          "order": 1,
          "status": "active",
          "isTest": false,
          "topics": [
            {
              "id": "topic-sp015-2022-2023-1-1",
              "slug": "1-1-dimensions-of-physical-quantities",
              "name": "1.1 Dimensions of physical quantities",
              "order": 1,
              "status": "active",
              "isTest": false,
              "subtopics": []
            },
            {
              "id": "topic-sp015-2022-2023-1-2",
              "slug": "1-2-scalars-and-vectors",
              "name": "1.2 Scalars and vectors",
              "order": 2,
              "status": "active",
              "isTest": false,
              "subtopics": []
            },
            {
              "id": "topic-sp015-2022-2023-1-3",
              "slug": "1-3-significant-figures-and-uncertainties-analysis",
              "name": "1.3 Significant figures and uncertainties analysis",
              "order": 3,
              "status": "active",
              "isTest": false,
              "subtopics": []
            }
          ]
        },
        {
          "id": "chapter-sp015-2022-2023-2",
          "slug": "2-0-kinematics-of-linear-motion",
          "name": "2.0 Kinematics of Linear Motion",
          "order": 2,
          "status": "active",
          "isTest": false,
          "topics": [
            {
              "id": "topic-sp015-2022-2023-2-1",
              "slug": "2-1-linear-motion",
              "name": "2.1 Linear motion",
              "order": 1,
              "status": "active",
              "isTest": false,
              "subtopics": []
            },
            {
              "id": "topic-sp015-2022-2023-2-2",
              "slug": "2-2-uniformly-accelerated-motion",
              "name": "2.2 Uniformly accelerated motion",
              "order": 2,
              "status": "active",
              "isTest": false,
              "subtopics": []
            },
            {
              "id": "topic-sp015-2022-2023-2-3",
              "slug": "2-3-projectile-motion",
              "name": "2.3 Projectile motion",
              "order": 3,
              "status": "active",
              "isTest": false,
              "subtopics": []
            }
          ]
        },
        {
          "id": "chapter-sp015-2022-2023-3",
          "slug": "3-0-dynamics-of-linear-motion",
          "name": "3.0 Dynamics of Linear Motion",
          "order": 3,
          "status": "active",
          "isTest": false,
          "topics": [
            {
              "id": "topic-sp015-2022-2023-3-1",
              "slug": "3-1-momentum-and-impulse",
              "name": "3.1 Momentum and impulse",
              "order": 1,
              "status": "active",
              "isTest": false,
              "subtopics": []
            },
            {
              "id": "topic-sp015-2022-2023-3-2",
              "slug": "3-2-conservation-of-linear-momentum",
              "name": "3.2 Conservation of linear momentum",
              "order": 2,
              "status": "active",
              "isTest": false,
              "subtopics": []
            },
            {
              "id": "topic-sp015-2022-2023-3-3",
              "slug": "3-3-basic-of-forces-and-free-body-diagram",
              "name": "3.3 Basic of forces and free body diagram",
              "order": 3,
              "status": "active",
              "isTest": false,
              "subtopics": []
            },
            {
              "id": "topic-sp015-2022-2023-3-4",
              "slug": "3-4-newton-s-laws-of-motion",
              "name": "3.4 Newton’s Laws of Motion",
              "order": 4,
              "status": "active",
              "isTest": false,
              "subtopics": []
            }
          ]
        },
        {
          "id": "chapter-sp015-2022-2023-4",
          "slug": "4-0-work-energy-and-power",
          "name": "4.0 Work, Energy and Power",
          "order": 4,
          "status": "active",
          "isTest": false,
          "topics": [
            {
              "id": "topic-sp015-2022-2023-4-1",
              "slug": "4-1-work",
              "name": "4.1 Work",
              "order": 1,
              "status": "active",
              "isTest": false,
              "subtopics": []
            },
            {
              "id": "topic-sp015-2022-2023-4-2",
              "slug": "4-2-energy-and-conservation-of-energy",
              "name": "4.2 Energy and Conservation of Energy",
              "order": 2,
              "status": "active",
              "isTest": false,
              "subtopics": []
            },
            {
              "id": "topic-sp015-2022-2023-4-3",
              "slug": "4-3-power",
              "name": "4.3 Power",
              "order": 3,
              "status": "active",
              "isTest": false,
              "subtopics": []
            }
          ]
        },
        {
          "id": "chapter-sp015-2022-2023-5",
          "slug": "5-0-circular-motion",
          "name": "5.0 Circular Motion",
          "order": 5,
          "status": "active",
          "isTest": false,
          "topics": [
            {
              "id": "topic-sp015-2022-2023-5-1",
              "slug": "5-1-parameters-in-circular-motion",
              "name": "5.1 Parameters in circular motion",
              "order": 1,
              "status": "active",
              "isTest": false,
              "subtopics": []
            },
            {
              "id": "topic-sp015-2022-2023-5-2",
              "slug": "5-2-uniform-circular-motion",
              "name": "5.2 Uniform circular motion",
              "order": 2,
              "status": "active",
              "isTest": false,
              "subtopics": []
            },
            {
              "id": "topic-sp015-2022-2023-5-3",
              "slug": "5-3-centripetal-force",
              "name": "5.3 Centripetal force",
              "order": 3,
              "status": "active",
              "isTest": false,
              "subtopics": []
            }
          ]
        },
        {
          "id": "chapter-sp015-2022-2023-6",
          "slug": "6-0-rotation-of-rigid-body",
          "name": "6.0 Rotation of Rigid Body",
          "order": 6,
          "status": "active",
          "isTest": false,
          "topics": [
            {
              "id": "topic-sp015-2022-2023-6-1",
              "slug": "6-1-rotational-kinematics",
              "name": "6.1 Rotational kinematics",
              "order": 1,
              "status": "active",
              "isTest": false,
              "subtopics": []
            },
            {
              "id": "topic-sp015-2022-2023-6-2",
              "slug": "6-2-equilibrium-of-a-uniform-rigid-body",
              "name": "6.2 Equilibrium of a uniform rigid body",
              "order": 2,
              "status": "active",
              "isTest": false,
              "subtopics": []
            },
            {
              "id": "topic-sp015-2022-2023-6-3",
              "slug": "6-3-rotational-dynamics",
              "name": "6.3 Rotational dynamics",
              "order": 3,
              "status": "active",
              "isTest": false,
              "subtopics": []
            },
            {
              "id": "topic-sp015-2022-2023-6-4",
              "slug": "6-4-conservation-of-angular-momentum",
              "name": "6.4 Conservation of angular momentum",
              "order": 4,
              "status": "active",
              "isTest": false,
              "subtopics": []
            }
          ]
        },
        {
          "id": "chapter-sp015-2022-2023-7",
          "slug": "7-0-simple-harmonic-motion-and-waves",
          "name": "7.0 Simple Harmonic Motion and Waves",
          "order": 7,
          "status": "active",
          "isTest": false,
          "topics": [
            {
              "id": "topic-sp015-2022-2023-7-1",
              "slug": "7-1-kinematics-of-simple-harmonic-motion",
              "name": "7.1 Kinematics of simple harmonic motion",
              "order": 1,
              "status": "active",
              "isTest": false,
              "subtopics": []
            },
            {
              "id": "topic-sp015-2022-2023-7-2",
              "slug": "7-2-graphs-of-simple-harmonic-motion",
              "name": "7.2 Graphs of simple harmonic motion",
              "order": 2,
              "status": "active",
              "isTest": false,
              "subtopics": []
            },
            {
              "id": "topic-sp015-2022-2023-7-3",
              "slug": "7-3-period-of-simple-harmonic-motion",
              "name": "7.3 Period of simple harmonic motion",
              "order": 3,
              "status": "active",
              "isTest": false,
              "subtopics": []
            },
            {
              "id": "topic-sp015-2022-2023-7-4",
              "slug": "7-4-properties-of-waves",
              "name": "7.4 Properties of waves",
              "order": 4,
              "status": "active",
              "isTest": false,
              "subtopics": []
            },